{
  "id": "calclab_f4e1662",
  "project": "calclab",
  "commit": {
    "hash": "f4e16628d834598274d826c81f3de99d4ecbabd9",
    "shortHash": "f4e1662",
    "author": "HMWKR",
    "date": "2026-01-12T16:53:57+09:00",
    "title": "docs: 5계층 프롬프트 품질 검수 시스템 구축 (15개 → 16개 필수 섹션)",
    "url": "https://github.com/HMWKR/CalcLab/commit/f4e16628d834598274d826c81f3de99d4ecbabd9"
  },
  "timestamp": "2026-01-13T12:57:58.544Z",
  "type": "docs",
  "complexity": "complex",
  "original": {
    "text": "5계층 프롬프트 품질 검수 시스템을 구축해줘.\n- 기존 15섹션에 프롬프트 품질 검수 섹션 추가 (16번째)\n- 객관적 기준 기반 평가 (주관적 \"좋다\" 배제)\n- 100% 검수 통과 필수 (계층 1 구조적 완성도)\n- 할루시네이션 검증 필수 (게이트키퍼)\n- 모든 사고 과정을 ultrathink 모드로 진행",
    "wordCount": 44,
    "lineCount": 6
  },
  "analysis": {
    "interpretation": "프롬프트 대시보드 데이터 품질 향상을 위한 정량적 평가 시스템 구축",
    "taskType": "convergent",
    "constraintLevel": "high",
    "keywords": [
      "5계층",
      "48점",
      "게이트키퍼",
      "ultrathink",
      "객관적",
      "기준"
    ]
  },
  "outcome": {
    "files": [
      "CLAUDE.md - 섹션 12-1 프롬프트 품질 검수 시스템 추가, 기존 12-1 → 12-2로 이동",
      "commitlint.config.cjs - 16번째 섹션 검증 패턴 추가",
      ".gitmessage - 5계층 48점 평가 템플릿 추가"
    ]
  },
  "tags": [
    "docs",
    "5계층",
    "48점",
    "게이트키퍼",
    "ultrathink",
    "객관적"
  ]
}