{
  "id": "calclab_1a7f36e",
  "project": "calclab",
  "commit": {
    "hash": "1a7f36e4c11f8ae8358897f2ae302e44ff40d720",
    "shortHash": "1a7f36e",
    "author": "HMWKR",
    "date": "2026-01-12T04:37:06+09:00",
    "title": "feat(modals): 모달/유틸리티 컴포넌트 반응형화",
    "url": "https://github.com/HMWKR/CalcLab/commit/1a7f36e4c11f8ae8358897f2ae302e44ff40d720"
  },
  "timestamp": "2026-01-13T12:57:58.513Z",
  "type": "feat",
  "complexity": "complex",
  "original": {
    "text": "10점 이상을 목표로 모든 작업을 진행을 해줘 모든 과정은 claude.md 지침을 반드시 준수를하며 작업을 진행해주고 ultrathink 모드로 반드시 항상 진행해줘",
    "wordCount": 20,
    "lineCount": 1
  },
  "analysis": {
    "interpretation": "모달/오버레이/유틸리티 컴포넌트의 반응형 미적용으로 인한 모바일 UX 저하 해결",
    "taskType": "convergent",
    "constraintLevel": "medium",
    "keywords": [
      "모달",
      "오버레이",
      "모바일",
      "UX"
    ]
  },
  "outcome": {
    "files": [
      "HelpModal.tsx - 탭/콘텐츠 반응형, 모바일 하단 시트",
      "KeybindingModal.tsx - 모달 크기/패딩 반응형",
      "CommandCenter/index.tsx - 좌우 분할→모바일 스택",
      "CommandPalette/index.tsx - 팔레트 너비 반응형",
      "SlashDropdown/index.tsx - 드롭다운 위치/크기 반응형",
      "Toast.tsx - 토스트 위치/크기 반응형",
      "ErrorBoundary.tsx - 에러 화면 반응형",
      "ConfirmDialog.tsx - 확인 다이얼로그 반응형"
    ]
  },
  "tags": [
    "feat",
    "모달",
    "오버레이",
    "모바일",
    "UX"
  ]
}