{
  "id": "promptproject_e60d770",
  "project": "promptproject",
  "commit": {
    "hash": "e60d770ae758bd25009bdf4ce0f05ec39487634a",
    "shortHash": "e60d770",
    "author": "HMWKR",
    "date": "2026-01-12T19:15:55+09:00",
    "title": "fix: Phase 3 UI/UX 검수 - P1/P2 이슈 수정",
    "url": "https://github.com/HMWKR/promptProject/commit/e60d770ae758bd25009bdf4ce0f05ec39487634a"
  },
  "timestamp": "2026-01-12T18:39:46.928Z",
  "type": "fix",
  "complexity": "complex",
  "original": {
    "text": "UI/UX 검수 체크리스트 7종을 적용하여 Phase 3 Prompt Library 전체를 검수하고\n발견된 이슈를 우선순위별로 수정하라",
    "wordCount": 15,
    "lineCount": 2
  },
  "analysis": {
    "interpretation": "정적 코드 리뷰 + 시나리오 검증으로 UI/UX 품질 개선",
    "taskType": "convergent",
    "constraintLevel": "high",
    "keywords": [
      "A11y",
      "confirm",
      "제거",
      "useCallback",
      "원본",
      "복원"
    ]
  },
  "optimized": {
    "text": "Phase 3 Prompt Library 시스템의 UI/UX를 검수합니다.\n대상: 6개 페이지 + 4개 컴포넌트\n\n체크리스트 7종:\n1. 요구 기능 누락/부분 구현\n2. 엣지케이스 오동작\n3. 상태/데이터 흐름 불일치\n4. 예외·에러 처리\n5. 성능 저하 지점\n6. 보안/입력 검증\n7. UX/A11y/웹표준\n\n출력: ISSUE 리스트 (우선순위 P0-P3)",
    "improvements": [],
    "techniques": [
      "self-verification"
    ]
  },
  "outcome": {
    "files": [
      "browse/page.tsx: AlertDialog 적용, 아이콘 버튼 접근성 개선",
      "builder/page.tsx: Pack별 카테고리 동적 매핑 (coding/creative/business)",
      "[id]/page.tsx: 편집 취소 시 원본값 복원 로직 handleCancelEdit() 추가",
      "version-history.tsx: useCallback 패턴 적용, AlertDialog로 confirm 대체"
    ]
  },
  "tags": [
    "fix",
    "A11y",
    "confirm",
    "제거",
    "useCallback",
    "원본"
  ]
}