{
  "id": "calclab_e01efb9",
  "project": "calclab",
  "commit": {
    "hash": "e01efb9bac9ff4a53d7e1bdf9d8e11fad837cb64",
    "shortHash": "e01efb9",
    "author": "HMWKR",
    "date": "2026-01-12T00:33:01+09:00",
    "title": "docs: 역할 프롬프팅 가이드라인 및 전문 용어 사전 추가",
    "url": "https://github.com/HMWKR/CalcLab/commit/e01efb9bac9ff4a53d7e1bdf9d8e11fad837cb64"
  },
  "timestamp": "2026-01-12T02:10:33.291Z",
  "type": "docs",
  "complexity": "complex",
  "original": {
    "text": "추가적으로 git에서 자동적으로 프롬프트 더 나은 프롬프트를 작성을 할때에\n전문적 용어를 사용함으로서 좀 더 구체화를 하는건 어떻게 생각해?",
    "wordCount": 18,
    "lineCount": 2
  },
  "analysis": {
    "interpretation": "최적화된 프롬프트에 역할 프롬프팅과 전문 용어를 추가하여 품질 향상",
    "taskType": "divergent",
    "constraintLevel": "low",
    "keywords": [
      "전문적",
      "용어",
      "구체화",
      "롤플레잉"
    ]
  },
  "outcome": {
    "files": [
      "docs/CLAUDE_TEMPLATE.md - 역할 프롬프팅 가이드라인 + 전문 용어 Quick Reference",
      "CLAUDE.md - 동일 내용 추가"
    ]
  },
  "tags": [
    "docs",
    "전문적",
    "용어",
    "구체화",
    "롤플레잉"
  ]
}