{
  "id": "calclab_f8eb077",
  "project": "calclab",
  "commit": {
    "hash": "f8eb07765e5dbae5f90269a7c587d5f15919f964",
    "shortHash": "f8eb077",
    "author": "HMWKR",
    "date": "2026-01-12T04:33:17+09:00",
    "title": "feat: 반응형 디자인 토큰 시스템 추가",
    "url": "https://github.com/HMWKR/CalcLab/commit/f8eb07765e5dbae5f90269a7c587d5f15919f964"
  },
  "timestamp": "2026-01-12T12:57:53.225Z",
  "type": "feat",
  "complexity": "complex",
  "original": {
    "text": "10점 이상을 목표로 모든 작업을 진행을 해줘. 코드 리뷰에서 하드코딩된 매직 넘버를 상수화하라는 피드백이 있었어.",
    "wordCount": 15,
    "lineCount": 1
  },
  "analysis": {
    "interpretation": "코드 리뷰 피드백 반영 - 70vh, w-80 등 하드코딩된 값을 상수로 추출",
    "taskType": "convergent",
    "constraintLevel": "high",
    "keywords": [
      "매직",
      "넘버",
      "상수화",
      "10점",
      "이상"
    ]
  },
  "optimized": {
    "text": "design-tokens.ts에 반응형 관련 상수를 추가해줘:\n1. RESPONSIVE: 하단 시트/사이드 패널 크기 상수\n2. RESPONSIVE_PADDING/SPACING/GRID: 브레이크포인트별 유틸리티\n3. A11Y: 접근성 속성 헬퍼\nTypeScript 타입 안전성 유지.",
    "improvements": [
      "카테고리별 구체적 요구사항 명시",
      "타입 안전성 제약 추가",
      "--",
      "🤖 Co-Authored-By: Claude Opus 4.5 <noreply@anthropic.com>"
    ],
    "techniques": []
  },
  "outcome": {
    "files": [
      "RESPONSIVE: 하단 시트 높이(70vh), 사이드 패널 너비(w-80) 상수",
      "RESPONSIVE_PADDING: 점진적 패딩 (px-4 sm:px-6 md:px-8 lg:px-10)",
      "RESPONSIVE_SPACING: 점진적 간격 (gap-2 sm:gap-3 md:gap-4)",
      "RESPONSIVE_GRID: 반응형 그리드 (cols2, cols3, cols4)",
      "A11Y: 접근성 속성 헬퍼 (modal, bottomSheet, closeButton)"
    ]
  },
  "tags": [
    "feat",
    "매직",
    "넘버",
    "상수화",
    "10점",
    "이상"
  ]
}