{
  "id": "promptproject_c235324",
  "project": "promptproject",
  "commit": {
    "hash": "c23532487f0ebd985a382459c4a51c41bbb6a26b",
    "shortHash": "c235324",
    "author": "HMWKR",
    "date": "2026-01-12T18:27:18+09:00",
    "title": "feat: BRIXO Prompt Refinery Platform + Phase 3 Prompt Library 시스템 구현",
    "url": "https://github.com/HMWKR/promptProject/commit/c23532487f0ebd985a382459c4a51c41bbb6a26b"
  },
  "timestamp": "2026-01-12T12:57:54.214Z",
  "type": "feat",
  "complexity": "complex",
  "original": {
    "text": "향후 개선 개선 할것들을 개선을 해줘 이것 또한 claude.md 지침을 반드시 준수를\n하며 ultrathink 모드로 작업을 진행을 해줘",
    "wordCount": 18,
    "lineCount": 2
  },
  "analysis": {
    "interpretation": "Phase 3 검수에서 식별된 개선 사항(폴더 선택 비활성화) 구현",
    "taskType": "convergent",
    "constraintLevel": "high",
    "keywords": [
      "개선",
      "ultrathink",
      "지침",
      "준수"
    ]
  },
  "outcome": {
    "files": [
      "prompt-vault/: Next.js 16 + Supabase + shadcn/ui 기반 프롬프트 관리 플랫폼",
      "Phase 1: 6탭 네비게이션, 3개 Pack, Intent/Stage 분류, 템플릿 40개, 가이드 모듈 40개",
      "Phase 2: Profile 시스템, Pipeline Editor, Lint 고도화",
      "Phase 3: Prompt Library (Dashboard/Add/Browse/Folders/상세 페이지)"
    ]
  },
  "tags": [
    "feat",
    "개선",
    "ultrathink",
    "지침",
    "준수"
  ]
}