{
  "id": "calclab_d3b7850",
  "project": "calclab",
  "commit": {
    "hash": "d3b78501ca264a5fbbf94d402dcbe3c0879ddebb",
    "shortHash": "d3b7850",
    "author": "HMWKR",
    "date": "2026-01-12T04:36:09+09:00",
    "title": "feat(workspace): CalcLineInput, ResultDisplay, VirtualCalcList 반응형화",
    "url": "https://github.com/HMWKR/CalcLab/commit/d3b78501ca264a5fbbf94d402dcbe3c0879ddebb"
  },
  "timestamp": "2026-01-13T06:41:22.164Z",
  "type": "feat",
  "complexity": "complex",
  "original": {
    "text": "10점 이상을 목표로 모든 작업을 진행을 해줘 모든 과정은 claude.md 지침을 반드시 준수를하며 작업을 진행해주고 ultrathink 모드로 반드시 항상 진행해줘",
    "wordCount": 20,
    "lineCount": 1
  },
  "analysis": {
    "interpretation": "반응형 웹 구현 검토 결과에서 발견된 모든 이슈를 해결하여 코드 리뷰 10점 달성",
    "taskType": "convergent",
    "constraintLevel": "high",
    "keywords": [
      "10점",
      "이상",
      "claude.md",
      "지침",
      "준수",
      "ultrathink",
      "모드"
    ]
  },
  "outcome": {
    "files": [
      "CalcLineInput.tsx - 모바일 수직 스택 레이아웃, 패딩/폰트 반응형",
      "ResultDisplay.tsx - 결과 영역 반응형 패딩/간격",
      "VirtualCalcList.tsx - 컨테이너 패딩 반응형"
    ]
  },
  "tags": [
    "feat",
    "10점",
    "이상",
    "claude.md",
    "지침",
    "준수"
  ]
}