{
  "id": "calclab_cf44842",
  "project": "calclab",
  "commit": {
    "hash": "cf4484291e9c24e29853949b5f76140c70ae4244",
    "shortHash": "cf44842",
    "author": "HMWKR",
    "date": "2026-01-12T04:36:46+09:00",
    "title": "feat(quick-access): QuickAccessPanel 하위 컴포넌트 반응형화",
    "url": "https://github.com/HMWKR/CalcLab/commit/cf4484291e9c24e29853949b5f76140c70ae4244"
  },
  "timestamp": "2026-01-13T12:57:58.507Z",
  "type": "feat",
  "complexity": "complex",
  "original": {
    "text": "10점 이상을 목표로 모든 작업을 진행을 해줘 모든 과정은 claude.md 지침을 반드시 준수를하며 작업을 진행해주고 ultrathink 모드로 반드시 항상 진행해줘",
    "wordCount": 20,
    "lineCount": 1
  },
  "analysis": {
    "interpretation": "QuickAccessPanel 하위 5개 컴포넌트의 반응형 미적용 이슈 해결",
    "taskType": "convergent",
    "constraintLevel": "medium",
    "keywords": [
      "터치",
      "타겟",
      "44px",
      "접근성"
    ]
  },
  "outcome": {
    "files": [
      "CategorySection.tsx - 카테고리 헤더/간격 반응형",
      "InlineHotkeyRecorder.tsx - 키 녹음 UI 반응형",
      "KeybindingList.tsx - 목록 패딩 반응형",
      "KeybindingListItem.tsx - 아이템 터치 타겟 44px 보장",
      "QuickAccessHeader.tsx - 헤더/검색/탭 반응형"
    ]
  },
  "tags": [
    "feat",
    "터치",
    "타겟",
    "44px",
    "접근성"
  ]
}