{
  "id": "calclab_b03fd20",
  "project": "calclab",
  "commit": {
    "hash": "b03fd200220c17a00ae0d29e1ed555396767b1b7",
    "shortHash": "b03fd20",
    "author": "HMWKR",
    "date": "2026-01-12T04:34:26+09:00",
    "title": "feat: Settings/Keybinding 반응형 그리드 적용",
    "url": "https://github.com/HMWKR/CalcLab/commit/b03fd200220c17a00ae0d29e1ed555396767b1b7"
  },
  "timestamp": "2026-01-12T06:44:24.607Z",
  "type": "feat",
  "complexity": "complex",
  "original": {
    "text": "P1 이슈: Settings 그리드가 grid-cols-4 고정이라 360px 화면에서 오버플로우. P2 이슈: 터치 타겟 44px 미달.",
    "wordCount": 15,
    "lineCount": 1
  },
  "analysis": {
    "interpretation": "Settings/Keybinding 컴포넌트의 그리드/터치 타겟 문제 해결",
    "taskType": "convergent",
    "constraintLevel": "medium",
    "keywords": [
      "P1",
      "P2",
      "grid-cols-4",
      "터치",
      "타겟",
      "44px"
    ]
  },
  "outcome": {
    "files": [
      "Settings: 테마/언어 그리드 1열→2열→4열 점진적 확대",
      "StatsPanel: 통계 그리드 (grid-cols-1 sm:grid-cols-2 lg:grid-cols-4)",
      "ProfileManager: 아이콘 버튼 터치 타겟 44px (w-10 h-10)",
      "SlotManager: 아이콘 피커 반응형 너비 (calc(100vw-2rem) max-w-[200px])",
      "QuickBindModal: 패딩/버튼 반응형 + body 스크롤 잠금",
      "PresetSelector: 그리드/패딩 반응형",
      "SelectionPopup, RepeatInputSuggestion: 패딩/버튼 반응형"
    ]
  },
  "tags": [
    "feat",
    "P1",
    "P2",
    "grid-cols-4",
    "터치",
    "타겟"
  ]
}