{
  "id": "promptproject_c783b12",
  "project": "promptproject",
  "commit": {
    "hash": "c783b12bc116dd8dda5736d53056beffd540b275",
    "shortHash": "c783b12",
    "author": "HMWKR",
    "date": "2026-01-12T18:25:04+09:00",
    "title": "chore: .gitignore 업데이트 및 CLAUDE.md 지침 강화",
    "url": "https://github.com/HMWKR/promptProject/commit/c783b12bc116dd8dda5736d53056beffd540b275"
  },
  "timestamp": "2026-01-12T18:39:46.902Z",
  "type": "chore",
  "complexity": "standard",
  "original": {
    "text": "향후 개선 개선 할것들을 개선을 해줘 이것 또한 claude.md 지침을 반드시 준수를\n하며 ultrathink 모드로 작업을 진행을 해줘",
    "wordCount": 18,
    "lineCount": 2
  },
  "analysis": {
    "interpretation": "Phase 3 검수에서 식별된 개선 사항 구현",
    "taskType": "convergent",
    "constraintLevel": "high",
    "keywords": [
      "개선",
      "ultrathink",
      "지침",
      "준수"
    ]
  },
  "outcome": {
    "files": [
      ".gitignore: 임시 파일 및 루트 레벨 패키지 파일 무시 규칙 추가",
      "CLAUDE.md: 프로젝트 지침 확장 (미션, 역할, 안전 규칙 추가)"
    ]
  },
  "tags": [
    "chore",
    "개선",
    "ultrathink",
    "지침",
    "준수"
  ]
}